{
  "$schema": "http://json-schema.org/draft-07/schema#",
  "$id": "correction.schema.json",
  "title": "Correction artifact (mechanism 4 — correction intake)",
  "description": "Append-only record of a human correction signal ('this is not pixel perfect!') or a deterministic auto-detected correction event (waiver created; UAT bug filed against a gate that rendered PASS). Written by scripts/correct.mjs to retro/corrections/<seq>-<slug>.correction.json. NEVER edited in place except to set `disposition` (null -> object). Undispositioned corrections render as red OPEN-CORRECTION lines that no gate may pass over.",
  "type": "object",
  "required": [
    "id",
    "ts",
    "utterance",
    "contradictedClaim",
    "mappedReqIds",
    "gateThatShouldHaveCaught",
    "failureMode",
    "source",
    "autoKey",
    "disposition"
  ],
  "additionalProperties": true,
  "properties": {
    "id": {
      "type": "string",
      "pattern": "^COR-\\d+$",
      "description": "Sequential id, COR-<n>, matching the numeric prefix of the file name."
    },
    "ts": {
      "type": "string",
      "description": "ISO-8601 timestamp of intake (not of the underlying event)."
    },
    "utterance": {
      "type": "string",
      "minLength": 1,
      "description": "The verbatim human correction, or an AUTO: sentence generated by a detector."
    },
    "contradictedClaim": {
      "type": ["string", "null"],
      "description": "file:line of the claim the correction contradicts (e.g. docs/current-state.md:85), or null when unknown."
    },
    "mappedReqIds": {
      "type": "array",
      "items": {
        "type": "string",
        "pattern": "^(FR|NFR|BC)-\\d+$"
      },
      "description": "Requirement ids the correction maps to. Empty array when not yet mapped."
    },
    "gateThatShouldHaveCaught": {
      "type": ["string", "null"],
      "enum": ["G0", "G1", "G2", "G3", "G4", "G5", "G6", "G7", "G8", null],
      "description": "The gate that rendered PASS but should have gone red, or null when unknown."
    },
    "failureMode": {
      "type": "string",
      "enum": [
        "vacuous-pass",
        "missing-check",
        "skipped-convention",
        "check-too-weak",
        "wrong-claim"
      ],
      "description": "How the process failed. Heuristic default is wrong-claim; overridable at intake via --failure-mode."
    },
    "failureModeSource": {
      "type": "string",
      "enum": ["heuristic", "explicit", "detector"],
      "description": "Whether failureMode was heuristically inferred, explicitly passed, or set by an auto-detector."
    },
    "source": {
      "type": "string",
      "enum": ["human", "auto-waiver", "auto-uat-bug"],
      "description": "human = CLI intake; auto-* = deterministic detector (waiver creation / UAT bug filed against a gate id)."
    },
    "autoKey": {
      "type": ["string", "null"],
      "description": "Detector dedupe key '<type>:<relPath>' for auto corrections; null for human intake."
    },
    "disposition": {
      "type": ["object", "null"],
      "description": "ALWAYS null at intake. Set exactly once when the correction is root-caused: this is the only permitted mutation of a correction artifact.",
      "required": ["status", "by", "ts"],
      "properties": {
        "status": {
          "type": "string",
          "enum": ["resolved", "waived", "invalid"],
          "description": "resolved = fixed with a Refs: PD-x commit; waived = human-signed acceptance; invalid = correction was mistaken (say why in note)."
        },
        "by": { "type": "string", "description": "Who dispositioned (human name/handle — never an agent)." },
        "ts": { "type": "string", "description": "ISO-8601 disposition timestamp." },
        "note": { "type": "string", "description": "Root cause / PD-x link / waiver rationale." }
      }
    }
  }
}
